{
  "schema_version": 1,
  "contract_id": "replace-me-contract",
  "product_id": "replace-me-product",
  "version": 1,
  "state": "issued",
  "confirmation": {
    "confirmation_id": "replace-me-contract-confirmation",
    "sha256": "0000000000000000000000000000000000000000000000000000000000000000"
  },
  "decided_by": "replace-me-owner",
  "decided_at": "1970-01-01T00:00:00.000Z",
  "source_interview": {
    "ref": "interviews/replace-me-interview/r1.json",
    "sha256": "0000000000000000000000000000000000000000000000000000000000000000"
  },
  "source_snapshot_digest": "0000000000000000000000000000000000000000000000000000000000000000",
  "claims": [
    {
      "claim_id": "replace-me-claim",
      "domain_id": "replace-me-domain",
      "statement": "Replace with an explicitly confirmed product truth.",
      "applicability": "Replace with the exact applicability boundary.",
      "evidence_card": {
        "ref": "evidence-cards/replace-me-card/r1.json",
        "sha256": "0000000000000000000000000000000000000000000000000000000000000000"
      },
      "authority_refs": [
        {
          "source_id": "replace-me-authority",
          "kind": "owner_statement",
          "artifact_ref": "interviews/replace-me-interview/r1.json",
          "digest": "0000000000000000000000000000000000000000000000000000000000000000"
        }
      ],
      "observation_refs": [],
      "false_accept_risk": "high",
      "false_reject_risk": "high",
      "dependencies": [],
      "lifecycle": "active"
    }
  ]
}
